<?xml version="1.0" encoding="UTF-8"?>
<!-- edited with XMLSpy v2008 rel. 2 (http://www.altova.com) by mazuki (darksiderg) -->
<xs:schema xmlns:xs="http://www.w3.org/2001/XMLSchema" elementFormDefault="qualified" attributeFormDefault="unqualified">
	<xs:element name="podcast">
		<xs:annotation>
			<xs:documentation>Comment describing your root element</xs:documentation>
		</xs:annotation>
		<xs:complexType>
			<xs:sequence>
				<xs:element name="posts">
					<xs:complexType>
						<xs:sequence>
							<xs:element name="post" maxOccurs="unbounded">
								<xs:complexType>
									<xs:sequence>
										<xs:element name="autor">
											<xs:complexType>
												<xs:sequence>
													<xs:element name="nombre" type="xs:string"/>
													<xs:element name="avatar" type="xs:string"/>
												</xs:sequence>
											</xs:complexType>
										</xs:element>
										<xs:element name="introduccion">
											<xs:simpleType>
												<xs:restriction base="xs:string">
													<xs:maxLength value="100"/>
												</xs:restriction>
											</xs:simpleType>
										</xs:element>
										<xs:element name="descripcion">
											<xs:simpleType>
												<xs:restriction base="xs:string">
													<xs:maxLength value="256"/>
												</xs:restriction>
											</xs:simpleType>
										</xs:element>
										<xs:element name="tiempo_lectura">
											<xs:simpleType>
												<xs:restriction base="xs:integer">
													<xs:minInclusive value="0"/>
												</xs:restriction>
											</xs:simpleType>
										</xs:element>
										<xs:element name="num_visualizaciones">
											<xs:simpleType>
												<xs:restriction base="xs:integer">
													<xs:minInclusive value="0"/>
												</xs:restriction>
											</xs:simpleType>
										</xs:element>
										<xs:element name="num_comentarios">
											<xs:simpleType>
												<xs:restriction base="xs:integer">
													<xs:minInclusive value="0"/>
												</xs:restriction>
											</xs:simpleType>
										</xs:element>
										<xs:element name="num_megusta">
											<xs:simpleType>
												<xs:restriction base="xs:integer">
													<xs:minInclusive value="0"/>
												</xs:restriction>
											</xs:simpleType>
										</xs:element>
										<xs:element name="imagen" type="xs:string" minOccurs="0"/>
									</xs:sequence>
									<xs:attribute name="fecha" use="required"/>
									<xs:attribute name="titulo" use="required">
										<xs:simpleType>
											<xs:restriction base="xs:string">
												<xs:maxLength value="100"/>
											</xs:restriction>
										</xs:simpleType>
									</xs:attribute>
								</xs:complexType>
							</xs:element>
						</xs:sequence>
					</xs:complexType>
				</xs:element>
			</xs:sequence>
		</xs:complexType>
	</xs:element>
</xs:schema>
